{
  "schema": "wof-alpha-dispatch-manifest-v1",
  "dispatchId": "ALPHA_V1_CANONICAL_PRODUCT_CONVERGENCE_P15_LONG_WORKER_V1",
  "createdAtUtc": "2026-09-05T07:15:00Z",
  "authorityCommit": "ad499d8ec63351401ee317e4ed2a3a85f2b8b57f",
  "immutable": true,
  "workers": [
    {
      "slot": 1,
      "stageId": "ALPHA_V1_PRODUCT_TAKEOVER_P15_CANONICAL_PRODUCT_CONVERGENCE_PACKAGE_CANDIDATE",
      "promptPath": "parallel/PM/ALPHA_V1_PRODUCT_TAKEOVER_P15_CANONICAL_PRODUCT_CONVERGENCE_PACKAGE_CANDIDATE_START_PROMPT.md",
      "dedupKey": "alpha.v1.product-takeover.canonical-product-convergence-package-candidate-v1",
      "resultProtocol": "wof-alpha-worker-result-v1",
      "resultJsonPath": "parallel/PM/RESULTS/ALPHA_V1_PRODUCT_TAKEOVER_P15_CANONICAL_PRODUCT_CONVERGENCE_PACKAGE_CANDIDATE_RESULT.json",
      "resultMdPath": "parallel/PM/RESULTS/ALPHA_V1_PRODUCT_TAKEOVER_P15_CANONICAL_PRODUCT_CONVERGENCE_PACKAGE_CANDIDATE_RESULT.md",
      "terminalCommitPrefix": "WORKER_RESULT ALPHA_V1_PRODUCT_TAKEOVER_P15_CANONICAL_PRODUCT_CONVERGENCE_PACKAGE_CANDIDATE"
    }
  ]
}
