{
  "schema": "wof-alpha-dispatch-manifest-v1",
  "dispatchId": "ALPHA_V1_CANONICAL_FINALIZATION_P15_P17_P18_LONG_3_WORKER_V1",
  "createdAtUtc": "2026-09-05T08:03:00Z",
  "authorityCommit": "d5f9ebd46f3856fade395402e57670f6cbb314b5",
  "immutable": true,
  "workers": [
    {
      "slot": 1,
      "stageId": "ALPHA_V1_PRODUCT_TAKEOVER_P15_CANONICAL_PRODUCT_CONVERGENCE_PACKAGE_CANDIDATE",
      "promptPath": "parallel/PM/ALPHA_V1_PRODUCT_TAKEOVER_P15_CANONICAL_PRODUCT_CONVERGENCE_PACKAGE_CANDIDATE_START_PROMPT.md",
      "dedupKey": "alpha.v1.product-takeover.canonical-product-convergence-package-candidate-v1",
      "resultProtocol": "wof-alpha-worker-result-v1",
      "resultJsonPath": "parallel/PM/RESULTS/ALPHA_V1_PRODUCT_TAKEOVER_P15_CANONICAL_PRODUCT_CONVERGENCE_PACKAGE_CANDIDATE_RESULT.json",
      "resultMdPath": "parallel/PM/RESULTS/ALPHA_V1_PRODUCT_TAKEOVER_P15_CANONICAL_PRODUCT_CONVERGENCE_PACKAGE_CANDIDATE_RESULT.md",
      "terminalCommitPrefix": "WORKER_RESULT ALPHA_V1_PRODUCT_TAKEOVER_P15_CANONICAL_PRODUCT_CONVERGENCE_PACKAGE_CANDIDATE"
    },
    {
      "slot": 2,
      "stageId": "ALPHA_V1_PRODUCT_TAKEOVER_P17_OWNER_FINAL_ACCEPTANCE_ORCHESTRATOR",
      "promptPath": "parallel/PM/ALPHA_V1_PRODUCT_TAKEOVER_P17_OWNER_FINAL_ACCEPTANCE_ORCHESTRATOR_START_PROMPT.md",
      "dedupKey": "alpha.v1.product-takeover.owner-final-acceptance-orchestrator-v1",
      "resultProtocol": "wof-alpha-worker-result-v1",
      "resultJsonPath": "parallel/PM/RESULTS/ALPHA_V1_PRODUCT_TAKEOVER_P17_OWNER_FINAL_ACCEPTANCE_ORCHESTRATOR_RESULT.json",
      "resultMdPath": "parallel/PM/RESULTS/ALPHA_V1_PRODUCT_TAKEOVER_P17_OWNER_FINAL_ACCEPTANCE_ORCHESTRATOR_RESULT.md",
      "terminalCommitPrefix": "WORKER_RESULT ALPHA_V1_PRODUCT_TAKEOVER_P17_OWNER_FINAL_ACCEPTANCE_ORCHESTRATOR"
    },
    {
      "slot": 3,
      "stageId": "ALPHA_V1_PRODUCT_TAKEOVER_P18_MAINTAINED_HUD_CANONICAL_DRAW_ACKNOWLEDGEMENT",
      "promptPath": "parallel/PM/ALPHA_V1_PRODUCT_TAKEOVER_P18_MAINTAINED_HUD_CANONICAL_DRAW_ACKNOWLEDGEMENT_START_PROMPT.md",
      "dedupKey": "alpha.v1.product-takeover.maintained-hud-canonical-draw-acknowledgement-v1",
      "resultProtocol": "wof-alpha-worker-result-v1",
      "resultJsonPath": "parallel/PM/RESULTS/ALPHA_V1_PRODUCT_TAKEOVER_P18_MAINTAINED_HUD_CANONICAL_DRAW_ACKNOWLEDGEMENT_RESULT.json",
      "resultMdPath": "parallel/PM/RESULTS/ALPHA_V1_PRODUCT_TAKEOVER_P18_MAINTAINED_HUD_CANONICAL_DRAW_ACKNOWLEDGEMENT_RESULT.md",
      "terminalCommitPrefix": "WORKER_RESULT ALPHA_V1_PRODUCT_TAKEOVER_P18_MAINTAINED_HUD_CANONICAL_DRAW_ACKNOWLEDGEMENT"
    }
  ]
}
