{
  "schema": "wof-alpha-dispatch-manifest-v1",
  "dispatchId": "ALPHA_V1_CANONICAL_RENDER_ANCHOR_P5_P8_P9_CONTINUATION_3_WORKER_V1",
  "createdAtUtc": "2026-09-05T06:13:00Z",
  "authorityCommit": "b858a8687eecdf3fe979a8ca76946006cbb42c93",
  "immutable": true,
  "workers": [
    {
      "slot": 1,
      "stageId": "ALPHA_V1_PRODUCT_TAKEOVER_P5_P1_CANONICAL_RENDER_ANCHOR_WIRING",
      "promptPath": "parallel/PM/ALPHA_V1_PRODUCT_TAKEOVER_P5_P1_CANONICAL_RENDER_ANCHOR_WIRING_START_PROMPT.md",
      "dedupKey": "alpha.v1.product-takeover.p1-canonical-render-anchor-wiring-v1",
      "resultProtocol": "wof-alpha-worker-result-v1",
      "resultJsonPath": "parallel/PM/RESULTS/ALPHA_V1_PRODUCT_TAKEOVER_P5_P1_CANONICAL_RENDER_ANCHOR_WIRING_RESULT.json",
      "resultMdPath": "parallel/PM/RESULTS/ALPHA_V1_PRODUCT_TAKEOVER_P5_P1_CANONICAL_RENDER_ANCHOR_WIRING_RESULT.md",
      "terminalCommitPrefix": "WORKER_RESULT ALPHA_V1_PRODUCT_TAKEOVER_P5_P1_CANONICAL_RENDER_ANCHOR_WIRING"
    },
    {
      "slot": 2,
      "stageId": "ALPHA_V1_PRODUCT_TAKEOVER_P8_CANONICAL_OVERLAY_PRODUCT_PLAN",
      "promptPath": "parallel/PM/ALPHA_V1_PRODUCT_TAKEOVER_P8_CANONICAL_OVERLAY_PRODUCT_PLAN_START_PROMPT.md",
      "dedupKey": "alpha.v1.product-takeover.canonical-overlay-product-plan-v1",
      "resultProtocol": "wof-alpha-worker-result-v1",
      "resultJsonPath": "parallel/PM/RESULTS/ALPHA_V1_PRODUCT_TAKEOVER_P8_CANONICAL_OVERLAY_PRODUCT_PLAN_RESULT.json",
      "resultMdPath": "parallel/PM/RESULTS/ALPHA_V1_PRODUCT_TAKEOVER_P8_CANONICAL_OVERLAY_PRODUCT_PLAN_RESULT.md",
      "terminalCommitPrefix": "WORKER_RESULT ALPHA_V1_PRODUCT_TAKEOVER_P8_CANONICAL_OVERLAY_PRODUCT_PLAN"
    },
    {
      "slot": 3,
      "stageId": "ALPHA_V1_PRODUCT_TAKEOVER_P9_CANONICAL_ANCHOR_RUNTIME_ENVELOPE",
      "promptPath": "parallel/PM/ALPHA_V1_PRODUCT_TAKEOVER_P9_CANONICAL_ANCHOR_RUNTIME_ENVELOPE_START_PROMPT.md",
      "dedupKey": "alpha.v1.product-takeover.canonical-anchor-runtime-envelope-v1",
      "resultProtocol": "wof-alpha-worker-result-v1",
      "resultJsonPath": "parallel/PM/RESULTS/ALPHA_V1_PRODUCT_TAKEOVER_P9_CANONICAL_ANCHOR_RUNTIME_ENVELOPE_RESULT.json",
      "resultMdPath": "parallel/PM/RESULTS/ALPHA_V1_PRODUCT_TAKEOVER_P9_CANONICAL_ANCHOR_RUNTIME_ENVELOPE_RESULT.md",
      "terminalCommitPrefix": "WORKER_RESULT ALPHA_V1_PRODUCT_TAKEOVER_P9_CANONICAL_ANCHOR_RUNTIME_ENVELOPE"
    }
  ]
}
