{
  "schema": "wof-alpha-dispatch-manifest-v1",
  "dispatchId": "ALPHA_V1_CANONICAL_OVERLAY_RUNTIME_HUD_PARALLEL_2_WORKER_V1",
  "createdAtUtc": "2026-09-05T06:31:00Z",
  "authorityCommit": "e8016d306a68361f1665ebf1ab7a9080e02307b1",
  "immutable": true,
  "workers": [
    {
      "slot": 1,
      "stageId": "ALPHA_V1_PRODUCT_TAKEOVER_P10_CANONICAL_ANCHOR_RUNTIME_TRANSPORT_BRIDGE",
      "promptPath": "parallel/PM/ALPHA_V1_PRODUCT_TAKEOVER_P10_CANONICAL_ANCHOR_RUNTIME_TRANSPORT_BRIDGE_START_PROMPT.md",
      "dedupKey": "alpha.v1.product-takeover.canonical-anchor-runtime-transport-bridge-v1",
      "resultProtocol": "wof-alpha-worker-result-v1",
      "resultJsonPath": "parallel/PM/RESULTS/ALPHA_V1_PRODUCT_TAKEOVER_P10_CANONICAL_ANCHOR_RUNTIME_TRANSPORT_BRIDGE_RESULT.json",
      "resultMdPath": "parallel/PM/RESULTS/ALPHA_V1_PRODUCT_TAKEOVER_P10_CANONICAL_ANCHOR_RUNTIME_TRANSPORT_BRIDGE_RESULT.md",
      "terminalCommitPrefix": "WORKER_RESULT ALPHA_V1_PRODUCT_TAKEOVER_P10_CANONICAL_ANCHOR_RUNTIME_TRANSPORT_BRIDGE"
    },
    {
      "slot": 2,
      "stageId": "ALPHA_V1_PRODUCT_TAKEOVER_P11_MAINTAINED_HUD_CANONICAL_OVERLAY_WIRING",
      "promptPath": "parallel/PM/ALPHA_V1_PRODUCT_TAKEOVER_P11_MAINTAINED_HUD_CANONICAL_OVERLAY_WIRING_START_PROMPT.md",
      "dedupKey": "alpha.v1.product-takeover.maintained-hud-canonical-overlay-wiring-v1",
      "resultProtocol": "wof-alpha-worker-result-v1",
      "resultJsonPath": "parallel/PM/RESULTS/ALPHA_V1_PRODUCT_TAKEOVER_P11_MAINTAINED_HUD_CANONICAL_OVERLAY_WIRING_RESULT.json",
      "resultMdPath": "parallel/PM/RESULTS/ALPHA_V1_PRODUCT_TAKEOVER_P11_MAINTAINED_HUD_CANONICAL_OVERLAY_WIRING_RESULT.md",
      "terminalCommitPrefix": "WORKER_RESULT ALPHA_V1_PRODUCT_TAKEOVER_P11_MAINTAINED_HUD_CANONICAL_OVERLAY_WIRING"
    }
  ]
}
