{
  "schema": "wof-alpha-dispatch-manifest-v1",
  "dispatchId": "ALPHA_V1_CANONICAL_RELEASE_P19_P20_P21_LONG_3_WORKER_V1",
  "createdAtUtc": "2026-09-05T08:34:00Z",
  "authorityCommit": "fd0cdc5bca4c92d5456a32c1ffd3fef569f48a9e",
  "immutable": true,
  "workers": [
    {
      "slot": 1,
      "stageId": "ALPHA_V1_PRODUCT_TAKEOVER_P19_FINAL_CANONICAL_CANDIDATE_REBUILD_ATTESTATION",
      "promptPath": "parallel/PM/ALPHA_V1_PRODUCT_TAKEOVER_P19_FINAL_CANONICAL_CANDIDATE_REBUILD_ATTESTATION_START_PROMPT.md",
      "dedupKey": "alpha.v1.product-takeover.final-canonical-candidate-rebuild-attestation-v1",
      "resultProtocol": "wof-alpha-worker-result-v1",
      "resultJsonPath": "parallel/PM/RESULTS/ALPHA_V1_PRODUCT_TAKEOVER_P19_FINAL_CANONICAL_CANDIDATE_REBUILD_ATTESTATION_RESULT.json",
      "resultMdPath": "parallel/PM/RESULTS/ALPHA_V1_PRODUCT_TAKEOVER_P19_FINAL_CANONICAL_CANDIDATE_REBUILD_ATTESTATION_RESULT.md",
      "terminalCommitPrefix": "WORKER_RESULT ALPHA_V1_PRODUCT_TAKEOVER_P19_FINAL_CANONICAL_CANDIDATE_REBUILD_ATTESTATION"
    },
    {
      "slot": 2,
      "stageId": "ALPHA_V1_PRODUCT_TAKEOVER_P20_OWNER_VISUAL_CONFIRMATION_ALPHA_LIVE_PROMOTION_GATE",
      "promptPath": "parallel/PM/ALPHA_V1_PRODUCT_TAKEOVER_P20_OWNER_VISUAL_CONFIRMATION_ALPHA_LIVE_PROMOTION_GATE_START_PROMPT.md",
      "dedupKey": "alpha.v1.product-takeover.owner-visual-confirmation-alpha-live-promotion-gate-v1",
      "resultProtocol": "wof-alpha-worker-result-v1",
      "resultJsonPath": "parallel/PM/RESULTS/ALPHA_V1_PRODUCT_TAKEOVER_P20_OWNER_VISUAL_CONFIRMATION_ALPHA_LIVE_PROMOTION_GATE_RESULT.json",
      "resultMdPath": "parallel/PM/RESULTS/ALPHA_V1_PRODUCT_TAKEOVER_P20_OWNER_VISUAL_CONFIRMATION_ALPHA_LIVE_PROMOTION_GATE_RESULT.md",
      "terminalCommitPrefix": "WORKER_RESULT ALPHA_V1_PRODUCT_TAKEOVER_P20_OWNER_VISUAL_CONFIRMATION_ALPHA_LIVE_PROMOTION_GATE"
    },
    {
      "slot": 3,
      "stageId": "ALPHA_V1_PRODUCT_TAKEOVER_P21_PREPROMOTION_EXACT_CANDIDATE_STAGING_ACCEPTANCE_HARNESS",
      "promptPath": "parallel/PM/ALPHA_V1_PRODUCT_TAKEOVER_P21_PREPROMOTION_EXACT_CANDIDATE_STAGING_ACCEPTANCE_HARNESS_START_PROMPT.md",
      "dedupKey": "alpha.v1.product-takeover.prepromotion-exact-candidate-staging-acceptance-harness-v1",
      "resultProtocol": "wof-alpha-worker-result-v1",
      "resultJsonPath": "parallel/PM/RESULTS/ALPHA_V1_PRODUCT_TAKEOVER_P21_PREPROMOTION_EXACT_CANDIDATE_STAGING_ACCEPTANCE_HARNESS_RESULT.json",
      "resultMdPath": "parallel/PM/RESULTS/ALPHA_V1_PRODUCT_TAKEOVER_P21_PREPROMOTION_EXACT_CANDIDATE_STAGING_ACCEPTANCE_HARNESS_RESULT.md",
      "terminalCommitPrefix": "WORKER_RESULT ALPHA_V1_PRODUCT_TAKEOVER_P21_PREPROMOTION_EXACT_CANDIDATE_STAGING_ACCEPTANCE_HARNESS"
    }
  ]
}
